label	text	textid
John	To him that overcometh will I grant to sit with me in my throne, even as I also overcame, and am set down with my Father in his throne.	4759
John	He that hath an ear, let him hear what the Spirit saith unto the churches.	4760
John	After this I looked, and, behold, a door [was] opened in heaven: and the first voice which I heard [was] as it were of a trumpet talking with me; which said, Come up hither, and I will shew thee things which must be hereafter.	4761
John	And immediately I was in the spirit: and, behold, a throne was set in heaven, and [one] sat on the throne.	4762
John	And he that sat was to look upon like a jasper and a sardine stone: and [there was] a rainbow round about the throne, in sight like unto an emerald.	4763
John	And round about the throne [were] four and twenty seats: and upon the seats I saw four and twenty elders sitting, clothed in white raiment; and they had on their heads crowns of gold.	4764
John	And out of the throne proceeded lightnings and thunderings and voices: and [there were] seven lamps of fire burning before the throne, which are the seven Spirits of God.	4765
John	And before the throne [there was] a sea of glass like unto crystal: and in the midst of the throne, and round about the throne, [were] four beasts full of eyes before and behind.	4766
John	And the first beast [was] like a lion, and the second beast like a calf, and the third beast had a face as a man, and the fourth beast [was] like a flying eagle.	4767
John	And the four beasts had each of them six wings about [him]; and [they were] full of eyes within: and they rest not day and night, saying, Holy, holy, holy, Lord God Almighty, which was, and is, and is to come.	4768
John	And when those beasts give glory and honour and thanks to him that sat on the throne, who liveth for ever and ever,	4769
John	The four and twenty elders fall down before him that sat on the throne, and worship him that liveth for ever and ever, and cast their crowns before the throne, saying,	4770
John	Thou art worthy, O Lord, to receive glory and honour and power: for thou hast created all things, and for thy pleasure they are and were created.	4771
John	And I saw in the right hand of him that sat on the throne a book written within and on the backside, sealed with seven seals.	4772
John	And I saw a strong angel proclaiming with a loud voice, Who is worthy to open the book, and to loose the seals thereof?	4773
John	And no man in heaven, nor in earth, neither under the earth, was able to open the book, neither to look thereon.	4774
John	And I wept much, because no man was found worthy to open and to read the book, neither to look thereon.	4775
John	And one of the elders saith unto me, Weep not: behold, the Lion of the tribe of Juda, the Root of David, hath prevailed to open the book, and to loose the seven seals thereof.	4776
John	And I beheld, and, lo, in the midst of the throne and of the four beasts, and in the midst of the elders, stood a Lamb as it had been slain, having seven horns and seven eyes, which are the seven Spirits of God sent forth into all the earth.	4777
John	And he came and took the book out of the right hand of him that sat upon the throne.	4778
John	And when he had taken the book, the four beasts and four [and] twenty elders fell down before the Lamb, having every one of them harps, and golden vials full of odours, which are the prayers of saints.	4779
John	And they sung a new song, saying, Thou art worthy to take the book, and to open the seals thereof: for thou wast slain, and hast redeemed us to God by thy blood out of every kindred, and tongue, and people, and nation;	4780
John	And hast made us unto our God kings and priests: and we shall reign on the earth.	4781
John	And I beheld, and I heard the voice of many angels round about the throne and the beasts and the elders: and the number of them was ten thousand times ten thousand, and thousands of thousands;	4782
John	Saying with a loud voice, Worthy is the Lamb that was slain to receive power, and riches, and wisdom, and strength, and honour, and glory, and blessing.	4783
John	And every creature which is in heaven, and on the earth, and under the earth, and such as are in the sea, and all that are in them, heard I saying, Blessing, and honour, and glory, and power, [be] unto him that sitteth upon the throne, and unto the Lamb for ever and ever.	4784
John	And the four beasts said, Amen.	4785
John	And the four [and] twenty elders fell down and worshipped him that liveth for ever and ever.	4786
John	And I saw when the Lamb opened one of the seals, and I heard, as it were the noise of thunder, one of the four beasts saying, Come and see.	4787
John	And I saw, and behold a white horse: and he that sat on him had a bow; and a crown was given unto him: and he went forth conquering, and to conquer.	4788
John	And when he had opened the second seal, I heard the second beast say, Come and see.	4789
John	And there went out another horse [that was] red: and [power] was given to him that sat thereon to take peace from the earth, and that they should kill one another: and there was given unto him a great sword.	4790
John	And when he had opened the third seal, I heard the third beast say, Come and see.	4791
John	And I beheld, and lo a black horse; and he that sat on him had a pair of balances in his hand.	4792
John	And I heard a voice in the midst of the four beasts say, A measure of wheat for a penny, and three measures of barley for a penny; and [see] thou hurt not the oil and the wine.	4793
John	And when he had opened the fourth seal, I heard the voice of the fourth beast say, Come and see.	4794
John	And I looked, and behold a pale horse: and his name that sat on him was Death, and Hell followed with him.	4795
John	And power was given unto them over the fourth part of the earth, to kill with sword, and with hunger, and with death, and with the beasts of the earth.	4796
John	And when he had opened the fifth seal, I saw under the altar the souls of them that were slain for the word of God, and for the testimony which they held:	4797
John	And they cried with a loud voice, saying, How long, O Lord, holy and true, dost thou not judge and avenge our blood on them that dwell on the earth?	4798
John	And white robes were given unto every one of them; and it was said unto them, that they should rest yet for a little season, until their fellowservants also and their brethren, that should be killed as they [were], should be fulfilled.	4799
John	And I beheld when he had opened the sixth seal, and, lo, there was a great earthquake; and the sun became black as sackcloth of hair, and the moon became as blood;	4800
John	And the stars of heaven fell unto the earth, even as a fig tree casteth her untimely figs, when she is shaken of a mighty wind.	4801
John	And the heaven departed as a scroll when it is rolled together; and every mountain and island were moved out of their places.	4802
John	And the kings of the earth, and the great men, and the rich men, and the chief captains, and the mighty men, and every bondman, and every free man, hid themselves in the dens and in the rocks of the mountains;	4803
John	And said to the mountains and rocks, Fall on us, and hide us from the face of him that sitteth on the throne, and from the wrath of the Lamb:	4804
John	For the great day of his wrath is come; and who shall be able to stand?	4805
John	And after these things I saw four angels standing on the four corners of the earth, holding the four winds of the earth, that the wind should not blow on the earth, nor on the sea, nor on any tree.	4806
John	And I saw another angel ascending from the east, having the seal of the living God: and he cried with a loud voice to the four angels, to whom it was given to hurt the earth and the sea,	4807
John	Saying, Hurt not the earth, neither the sea, nor the trees, till we have sealed the servants of our God in their foreheads.	4808
John	And I heard the number of them which were sealed: [and there were] sealed an hundred [and] forty [and] four thousand of all the tribes of the children of Israel.	4809
John	Of the tribe of Juda [were] sealed twelve thousand.	4810
John	Of the tribe of Reuben [were] sealed twelve thousand.	4811
John	Of the tribe of Gad [were] sealed twelve thousand.	4812
John	Of the tribe of Aser [were] sealed twelve thousand.	4813
John	Of the tribe of Nepthalim [were] sealed twelve thousand.	4814
John	Of the tribe of Manasses [were] sealed twelve thousand.	4815
John	Of the tribe of Simeon [were] sealed twelve thousand.	4816
John	Of the tribe of Levi [were] sealed twelve thousand.	4817
John	Of the tribe of Issachar [were] sealed twelve thousand.	4818
Paul	Paul, a servant of Jesus Christ, called [to be] an apostle, separated unto the gospel of God,	4819
Paul	(Which he had promised afore by his prophets in the holy scriptures,)	4820
Paul	Concerning his Son Jesus Christ our Lord, which was made of the seed of David according to the flesh;	4821
Paul	And declared [to be] the Son of God with power, according to the spirit of holiness, by the resurrection from the dead:	4822
Paul	By whom we have received grace and apostleship, for obedience to the faith among all nations, for his name:	4823
Paul	Among whom are ye also the called of Jesus Christ:	4824
Paul	To all that be in Rome, beloved of God, called [to be] saints: Grace to you and peace from God our Father, and the Lord Jesus Christ.	4825
Paul	First, I thank my God through Jesus Christ for you all, that your faith is spoken of throughout the whole world.	4826
Paul	For God is my witness, whom I serve with my spirit in the gospel of his Son, that without ceasing I make mention of you always in my prayers;	4827
Paul	Making request, if by any means now at length I might have a prosperous journey by the will of God to come unto you.	4828
Paul	For I long to see you, that I may impart unto you some spiritual gift, to the end ye may be established;	4829
Paul	That is, that I may be comforted together with you by the mutual faith both of you and me.	4830
Paul	Now I would not have you ignorant, brethren, that oftentimes I purposed to come unto you, (but was let hitherto,) that I might have some fruit among you also, even as among other Gentiles.	4831
Paul	I am debtor both to the Greeks, and to the Barbarians; both to the wise, and to the unwise.	4832
Paul	So, as much as in me is, I am ready to preach the gospel to you that are at Rome also.	4833
Paul	For I am not ashamed of the gospel of Christ: for it is the power of God unto salvation to every one that believeth; to the Jew first, and also to the Greek.	4834
Paul	For therein is the righteousness of God revealed from faith to faith: as it is written, The just shall live by faith.	4835
Paul	For the wrath of God is revealed from heaven against all ungodliness and unrighteousness of men, who hold the truth in unrighteousness;	4836
Paul	Because that which may be known of God is manifest in them; for God hath shewed [it] unto them.	4837
Paul	For the invisible things of him from the creation of the world are clearly seen, being understood by the things that are made, [even] his eternal power and Godhead; so that they are without excuse:	4838
Paul	Because that, when they knew God, they glorified [him] not as God, neither were thankful; but became vain in their imaginations, and their foolish heart was darkened.	4839
Paul	Professing themselves to be wise, they became fools,	4840
Paul	And changed the glory of the uncorruptible God into an image made like to corruptible man, and to birds, and fourfooted beasts, and creeping things.	4841
Paul	Wherefore God also gave them up to uncleanness through the lusts of their own hearts, to dishonour their own bodies between themselves:	4842
Paul	Who changed the truth of God into a lie, and worshipped and served the creature more than the Creator, who is blessed for ever.	4843
Paul	Amen.	4844
Paul	For this cause God gave them up unto vile affections: for even their women did change the natural use into that which is against nature:	4845
Paul	And likewise also the men, leaving the natural use of the woman, burned in their lust one toward another; men with men working that which is unseemly, and receiving in themselves that recompence of their error which was meet.	4846
Paul	And even as they did not like to retain God in [their] knowledge, God gave them over to a reprobate mind, to do those things which are not convenient;	4847
Paul	Being filled with all unrighteousness, fornication, wickedness, covetousness, maliciousness; full of envy, murder, debate, deceit, malignity; whisperers,	4848
Paul	Backbiters, haters of God, despiteful, proud, boasters, inventors of evil things, disobedient to parents,	4849
Paul	Without understanding, covenantbreakers, without natural affection, implacable, unmerciful:	4850
Paul	Who knowing the judgment of God, that they which commit such things are worthy of death, not only do the same, but have pleasure in them that do them.	4851
Paul	Therefore thou art inexcusable, O man, whosoever thou art that judgest: for wherein thou judgest another, thou condemnest thyself; for thou that judgest doest the same things.	4852
Paul	But we are sure that the judgment of God is according to truth against them which commit such things.	4853
Paul	And thinkest thou this, O man, that judgest them which do such things, and doest the same, that thou shalt escape the judgment of God?	4854
Paul	Or despisest thou the riches of his goodness and forbearance and longsuffering; not knowing that the goodness of God leadeth thee to repentance?	4855
Paul	But after thy hardness and impenitent heart treasurest up unto thyself wrath against the day of wrath and revelation of the righteous judgment of God;	4856
Paul	Who will render to every man according to his deeds:	4857
Paul	To them who by patient continuance in well doing seek for glory and honour and immortality, eternal life:	4858
Paul	But unto them that are contentious, and do not obey the truth, but obey unrighteousness, indignation and wrath,	4859
Paul	Tribulation and anguish, upon every soul of man that doeth evil, of the Jew first, and also of the Gentile;	4860
Paul	But glory, honour, and peace, to every man that worketh good, to the Jew first, and also to the Gentile:	4861
Paul	For there is no respect of persons with God.	4862
Paul	For as many as have sinned without law shall also perish without law: and as many as have sinned in the law shall be judged by the law;	4863
Paul	(For not the hearers of the law [are] just before God, but the doers of the law shall be justified.	4864
Paul	For when the Gentiles, which have not the law, do by nature the things contained in the law, these, having not the law, are a law unto themselves:	4865
Paul	Which shew the work of the law written in their hearts, their conscience also bearing witness, and [their] thoughts the mean while accusing or else excusing one another;)	4866
Paul	In the day when God shall judge the secrets of men by Jesus Christ according to my gospel.	4867
Paul	Behold, thou art called a Jew, and restest in the law, and makest thy boast of God,	4868
Paul	And knowest [his] will, and approvest the things that are more excellent, being instructed out of the law;	4869
Paul	And art confident that thou thyself art a guide of the blind, a light of them which are in darkness,	4870
Paul	An instructor of the foolish, a teacher of babes, which hast the form of knowledge and of the truth in the law.	4871
Paul	Thou therefore which teachest another, teachest thou not thyself?	4872
Paul	thou that preachest a man should not steal, dost thou steal?	4873
Paul	Thou that sayest a man should not commit adultery, dost thou commit adultery?	4874
Paul	thou that abhorrest idols, dost thou commit sacrilege?	4875
Paul	Thou that makest thy boast of the law, through breaking the law dishonourest thou God?	4876
Paul	For the name of God is blasphemed among the Gentiles through you, as it is written.	4877
Paul	For circumcision verily profiteth, if thou keep the law: but if thou be a breaker of the law, thy circumcision is made uncircumcision.	4878
Paul	Therefore if the uncircumcision keep the righteousness of the law, shall not his uncircumcision be counted for circumcision?	4879
Paul	And shall not uncircumcision which is by nature, if it fulfil the law, judge thee, who by the letter and circumcision dost transgress the law?	4880
Paul	For he is not a Jew, which is one outwardly; neither [is that] circumcision, which is outward in the flesh:	4881
Paul	But he [is] a Jew, which is one inwardly; and circumcision [is that] of the heart, in the spirit, [and] not in the letter; whose praise [is] not of men, but of God.	4882
Paul	What advantage then hath the Jew?	4883
Paul	or what profit [is there] of circumcision?	4884
Paul	Much every way: chiefly, because that unto them were committed the oracles of God.	4885
Paul	For what if some did not believe?	4886
Paul	shall their unbelief make the faith of God without effect?	4887
Paul	God forbid: yea, let God be true, but every man a liar; as it is written, That thou mightest be justified in thy sayings, and mightest overcome when thou art judged.	4888
Paul	But if our unrighteousness commend the righteousness of God, what shall we say?	4889
Paul	[Is] God unrighteous who taketh vengeance?	4890
Paul	(I speak as a man)	4891
Paul	God forbid: for then how shall God judge the world?	4892
Paul	For if the truth of God hath more abounded through my lie unto his glory; why yet am I also judged as a sinner?	4893
Paul	And not [rather], (as we be slanderously reported, and as some affirm that we say,) Let us do evil, that good may come?	4894
Paul	whose damnation is just.	4895
Paul	What then?	4896
Paul	are we better [than they]?	4897
Paul	No, in no wise: for we have before proved both Jews and Gentiles, that they are all under sin;	4898
Paul	As it is written, There is none righteous, no, not one:	4899
Paul	There is none that understandeth, there is none that seeketh after God.	4900
Paul	They are all gone out of the way, they are together become unprofitable; there is none that doeth good, no, not one.	4901
Paul	Their throat [is] an open sepulchre; with their tongues they have used deceit; the poison of asps [is] under their lips:	4902
Paul	Whose mouth [is] full of cursing and bitterness:	4903
Paul	Their feet [are] swift to shed blood:	4904
Paul	Destruction and misery [are] in their ways:	4905
Paul	And the way of peace have they not known:	4906
Paul	There is no fear of God before their eyes.	4907
Paul	Now we know that what things soever the law saith, it saith to them who are under the law: that every mouth may be stopped, and all the world may become guilty before God.	4908
Paul	Therefore by the deeds of the law there shall no flesh be justified in his sight: for by the law [is] the knowledge of sin.	4909
Paul	But now the righteousness of God without the law is manifested, being witnessed by the law and the prophets;	4910
Paul	Even the righteousness of God [which is] by faith of Jesus Christ unto all and upon all them that believe: for there is no difference:	4911
Paul	For all have sinned, and come short of the glory of God;	4912
Paul	Being justified freely by his grace through the redemption that is in Christ Jesus:	4913
Paul	Whom God hath set forth [to be] a propitiation through faith in his blood, to declare his righteousness for the remission of sins that are past, through the forbearance of God;	4914
Paul	To declare, [I say], at this time his righteousness: that he might be just, and the justifier of him which believeth in Jesus.	4915
Paul	Where [is] boasting then?	4916
Paul	It is excluded.	4917
Paul	By what law?	4918
Paul	of works?	4919
Paul	Nay: but by the law of faith.	4920
Paul	Therefore we conclude that a man is justified by faith without the deeds of the law.	4921
Paul	[Is he] the God of the Jews only?	4922
Paul	[is he] not also of the Gentiles?	4923
Paul	Yes, of the Gentiles also:	4924
Paul	Seeing [it is] one God, which shall justify the circumcision by faith, and uncircumcision through faith.	4925
Paul	Do we then make void the law through faith?	4926
Paul	God forbid: yea, we establish the law.	4927
Paul	What shall we say then that Abraham our father, as pertaining to the flesh, hath found?	4928
Paul	For if Abraham were justified by works, he hath [whereof] to glory; but not before God.	4929
Paul	For what saith the scripture?	4930
Paul	Abraham believed God, and it was counted unto him for righteousness.	4931
Paul	Now to him that worketh is the reward not reckoned of grace, but of debt.	4932
Paul	But to him that worketh not, but believeth on him that justifieth the ungodly, his faith is counted for righteousness.	4933
Paul	Even as David also describeth the blessedness of the man, unto whom God imputeth righteousness without works,	4934
Paul	[Saying], Blessed [are] they whose iniquities are forgiven, and whose sins are covered.	4935
Paul	Blessed [is] the man to whom the Lord will not impute sin.	4936
Paul	[Cometh] this blessedness then upon the circumcision [only], or upon the uncircumcision also?	4937
Paul	for we say that faith was reckoned to Abraham for righteousness.	4938
Paul	How was it then reckoned?	4939
Paul	when he was in circumcision, or in uncircumcision?	4940
Paul	Not in circumcision, but in uncircumcision.	4941
Paul	And he received the sign of circumcision, a seal of the righteousness of the faith which [he had yet] being uncircumcised: that he might be the father of all them that believe, though they be not circumcised; that righteousness might be imputed unto them also:	4942
Paul	And the father of circumcision to them who are not of the circumcision only, but who also walk in the steps of that faith of our father Abraham, which [he had] being [yet] uncircumcised.	4943
Paul	For the promise, that he should be the heir of the world, [was] not to Abraham, or to his seed, through the law, but through the righteousness of faith.	4944
Paul	For if they which are of the law [be] heirs, faith is made void, and the promise made of none effect:	4945
Paul	Because the law worketh wrath: for where no law is, [there is] no transgression.	4946
Paul	Therefore [it is] of faith, that [it might be] by grace; to the end the promise might be sure to all the seed; not to that only which is of the law, but to that also which is of the faith of Abraham; who is the father of us all,	4947
Paul	(As it is written, I have made thee a father of many nations,) before him whom he believed, [even] God, who quickeneth the dead, and calleth those things which be not as though they were.	4948
Paul	Who against hope believed in hope, that he might become the father of many nations; according to that which was spoken, So shall thy seed be.	4949
Paul	And being not weak in faith, he considered not his own body now dead, when he was about an hundred years old, neither yet the deadness of Sara’s womb:	4950
Paul	He staggered not at the promise of God through unbelief; but was strong in faith, giving glory to God;	4951
Paul	And being fully persuaded that, what he had promised, he was able also to perform.	4952
Paul	And therefore it was imputed to him for righteousness.	4953
Paul	Now it was not written for his sake alone, that it was imputed to him;	4954
Paul	But for us also, to whom it shall be imputed, if we believe on him that raised up Jesus our Lord from the dead;	4955
Paul	Who was delivered for our offences, and was raised again for our justification.	4956
Paul	Therefore being justified by faith, we have peace with God through our Lord Jesus Christ:	4957
Paul	By whom also we have access by faith into this grace wherein we stand, and rejoice in hope of the glory of God.	4958
Paul	And not only [so], but we glory in tribulations also: knowing that tribulation worketh patience;	4959
Paul	And patience, experience; and experience, hope:	4960
Paul	And hope maketh not ashamed; because the love of God is shed abroad in our hearts by the Holy Ghost which is given unto us.	4961
Paul	For when we were yet without strength, in due time Christ died for the ungodly.	4962
Paul	For scarcely for a righteous man will one die: yet peradventure for a good man some would even dare to die.	4963
Paul	But God commendeth his love toward us, in that, while we were yet sinners, Christ died for us.	4964
Paul	Much more then, being now justified by his blood, we shall be saved from wrath through him.	4965
Paul	For if, when we were enemies, we were reconciled to God by the death of his Son, much more, being reconciled, we shall be saved by his life.	4966
Paul	And not only [so], but we also joy in God through our Lord Jesus Christ, by whom we have now received the atonement.	4967
Paul	Wherefore, as by one man sin entered into the world, and death by sin; and so death passed upon all men, for that all have sinned:	4968
Paul	(For until the law sin was in the world: but sin is not imputed when there is no law.	4969
Paul	Nevertheless death reigned from Adam to Moses, even over them that had not sinned after the similitude of Adam’s transgression, who is the figure of him that was to come.	4970
Paul	But not as the offence, so also [is] the free gift.	4971
Paul	For if through the offence of one many be dead, much more the grace of God, and the gift by grace, [which is] by one man, Jesus Christ, hath abounded unto many.	4972
Paul	And not as [it was] by one that sinned, [so is] the gift: for the judgment [was] by one to condemnation, but the free gift [is] of many offences unto justification.	4973
Paul	For if by one man’s offence death reigned by one; much more they which receive abundance of grace and of the gift of righteousness shall reign in life by one, Jesus Christ.)	4974
Paul	Therefore as by the offence of one [judgment came] upon all men to condemnation; even so by the righteousness of one [the free gift came] upon all men unto justification of life.	4975
