label	text	textid
Luke	Then fled Moses at this saying, and was a stranger in the land of Madian, where he begat two sons.	3139
Luke	And when forty years were expired, there appeared to him in the wilderness of mount Sina an angel of the Lord in a flame of fire in a bush.	3140
Luke	When Moses saw [it], he wondered at the sight: and as he drew near to behold [it], the voice of the Lord came unto him,	3141
Luke	[Saying], I [am] the God of thy fathers, the God of Abraham, and the God of Isaac, and the God of Jacob.	3142
Luke	Then Moses trembled, and durst not behold.	3143
Luke	Then said the Lord to him, Put off thy shoes from thy feet: for the place where thou standest is holy ground.	3144
Luke	I have seen, I have seen the affliction of my people which is in Egypt, and I have heard their groaning, and am come down to deliver them.	3145
Luke	And now come, I will send thee into Egypt.	3146
Luke	This Moses whom they refused, saying, Who made thee a ruler and a judge?	3147
Luke	the same did God send [to be] a ruler and a deliverer by the hand of the angel which appeared to him in the bush.	3148
Luke	He brought them out, after that he had shewed wonders and signs in the land of Egypt, and in the Red sea, and in the wilderness forty years.	3149
Luke	This is that Moses, which said unto the children of Israel, A prophet shall the Lord your God raise up unto you of your brethren, like unto me; him shall ye hear.	3150
Luke	This is he, that was in the church in the wilderness with the angel which spake to him in the mount Sina, and [with] our fathers: who received the lively oracles to give unto us:	3151
Luke	To whom our fathers would not obey, but thrust [him] from them, and in their hearts turned back again into Egypt,	3152
Luke	Saying unto Aaron, Make us gods to go before us: for [as for] this Moses, which brought us out of the land of Egypt, we wot not what is become of him.	3153
Luke	And they made a calf in those days, and offered sacrifice unto the idol, and rejoiced in the works of their own hands.	3154
Luke	Then God turned, and gave them up to worship the host of heaven; as it is written in the book of the prophets, O ye house of Israel, have ye offered to me slain beasts and sacrifices [by the space of] forty years in the wilderness?	3155
Luke	Yea, ye took up the tabernacle of Moloch, and the star of your god Remphan, figures which ye made to worship them: and I will carry you away beyond Babylon.	3156
Luke	Our fathers had the tabernacle of witness in the wilderness, as he had appointed, speaking unto Moses, that he should make it according to the fashion that he had seen.	3157
Luke	Which also our fathers that came after brought in with Jesus into the possession of the Gentiles, whom God drave out before the face of our fathers, unto the days of David;	3158
Luke	Who found favour before God, and desired to find a tabernacle for the God of Jacob.	3159
Luke	But Solomon built him an house.	3160
Luke	Howbeit the most High dwelleth not in temples made with hands; as saith the prophet,	3161
Luke	Heaven [is] my throne, and earth [is] my footstool: what house will ye build me?	3162
Luke	saith the Lord: or what [is] the place of my rest?	3163
Luke	Hath not my hand made all these things?	3164
Luke	Ye stiffnecked and uncircumcised in heart and ears, ye do always resist the Holy Ghost: as your fathers [did], so [do] ye.	3165
Luke	Which of the prophets have not your fathers persecuted?	3166
Luke	and they have slain them which shewed before of the coming of the Just One; of whom ye have been now the betrayers and murderers:	3167
Luke	Who have received the law by the disposition of angels, and have not kept [it].	3168
Luke	When they heard these things, they were cut to the heart, and they gnashed on him with [their] teeth.	3169
Luke	But he, being full of the Holy Ghost, looked up stedfastly into heaven, and saw the glory of God, and Jesus standing on the right hand of God,	3170
Luke	And said, Behold, I see the heavens opened, and the Son of man standing on the right hand of God.	3171
Luke	Then they cried out with a loud voice, and stopped their ears, and ran upon him with one accord,	3172
Luke	And cast [him] out of the city, and stoned [him]: and the witnesses laid down their clothes at a young man’s feet, whose name was Saul.	3173
Luke	And they stoned Stephen, calling upon [God], and saying, Lord Jesus, receive my spirit.	3174
Luke	And he kneeled down, and cried with a loud voice, Lord, lay not this sin to their charge.	3175
Luke	And when he had said this, he fell asleep.	3176
Luke	And Saul was consenting unto his death.	3177
Luke	And at that time there was a great persecution against the church which was at Jerusalem; and they were all scattered abroad throughout the regions of Judaea and Samaria, except the apostles.	3178
Luke	And devout men carried Stephen [to his burial], and made great lamentation over him.	3179
Luke	As for Saul, he made havock of the church, entering into every house, and haling men and women committed [them] to prison.	3180
Luke	Therefore they that were scattered abroad went every where preaching the word.	3181
Luke	Then Philip went down to the city of Samaria, and preached Christ unto them.	3182
Luke	And the people with one accord gave heed unto those things which Philip spake, hearing and seeing the miracles which he did.	3183
Luke	For unclean spirits, crying with loud voice, came out of many that were possessed [with them]: and many taken with palsies, and that were lame, were healed.	3184
Luke	And there was great joy in that city.	3185
Luke	But there was a certain man, called Simon, which beforetime in the same city used sorcery, and bewitched the people of Samaria, giving out that himself was some great one:	3186
Luke	To whom they all gave heed, from the least to the greatest, saying, This man is the great power of God.	3187
Luke	And to him they had regard, because that of long time he had bewitched them with sorceries.	3188
Luke	But when they believed Philip preaching the things concerning the kingdom of God, and the name of Jesus Christ, they were baptized, both men and women.	3189
Luke	Then Simon himself believed also: and when he was baptized, he continued with Philip, and wondered, beholding the miracles and signs which were done.	3190
Luke	Now when the apostles which were at Jerusalem heard that Samaria had received the word of God, they sent unto them Peter and John:	3191
Luke	Who, when they were come down, prayed for them, that they might receive the Holy Ghost:	3192
Luke	(For as yet he was fallen upon none of them: only they were baptized in the name of the Lord Jesus.)	3193
Luke	Then laid they [their] hands on them, and they received the Holy Ghost.	3194
Luke	And when Simon saw that through laying on of the apostles’ hands the Holy Ghost was given, he offered them money,	3195
Luke	Saying, Give me also this power, that on whomsoever I lay hands, he may receive the Holy Ghost.	3196
Luke	But Peter said unto him, Thy money perish with thee, because thou hast thought that the gift of God may be purchased with money.	3197
Luke	Thou hast neither part nor lot in this matter: for thy heart is not right in the sight of God.	3198
Luke	Repent therefore of this thy wickedness, and pray God, if perhaps the thought of thine heart may be forgiven thee.	3199
Luke	For I perceive that thou art in the gall of bitterness, and [in] the bond of iniquity.	3200
Luke	Then answered Simon, and said, Pray ye to the Lord for me, that none of these things which ye have spoken come upon me.	3201
Luke	And they, when they had testified and preached the word of the Lord, returned to Jerusalem, and preached the gospel in many villages of the Samaritans.	3202
Luke	And the angel of the Lord spake unto Philip, saying, Arise, and go toward the south unto the way that goeth down from Jerusalem unto Gaza, which is desert.	3203
Luke	And he arose and went: and, behold, a man of Ethiopia, an eunuch of great authority under Candace queen of the Ethiopians, who had the charge of all her treasure, and had come to Jerusalem for to worship,	3204
Luke	Was returning, and sitting in his chariot read Esaias the prophet.	3205
Luke	Then the Spirit said unto Philip, Go near, and join thyself to this chariot.	3206
Luke	And Philip ran thither to [him], and heard him read the prophet Esaias, and said, Understandest thou what thou readest?	3207
Luke	And he said, How can I, except some man should guide me?	3208
Luke	And he desired Philip that he would come up and sit with him.	3209
Luke	The place of the scripture which he read was this, He was led as a sheep to the slaughter; and like a lamb dumb before his shearer, so opened he not his mouth:	3210
Luke	In his humiliation his judgment was taken away: and who shall declare his generation?	3211
Luke	for his life is taken from the earth.	3212
Luke	And the eunuch answered Philip, and said, I pray thee, of whom speaketh the prophet this?	3213
Luke	of himself, or of some other man?	3214
Luke	Then Philip opened his mouth, and began at the same scripture, and preached unto him Jesus.	3215
Luke	And as they went on [their] way, they came unto a certain water: and the eunuch said, See, [here is] water; what doth hinder me to be baptized?	3216
Luke	And Philip said, If thou believest with all thine heart, thou mayest.	3217
Luke	And he answered and said, I believe that Jesus Christ is the Son of God.	3218
Luke	And he commanded the chariot to stand still: and they went down both into the water, both Philip and the eunuch; and he baptized him.	3219
Luke	And when they were come up out of the water, the Spirit of the Lord caught away Philip, that the eunuch saw him no more: and he went on his way rejoicing.	3220
Luke	But Philip was found at Azotus: and passing through he preached in all the cities, till he came to Caesarea.	3221
Luke	And Saul, yet breathing out threatenings and slaughter against the disciples of the Lord, went unto the high priest,	3222
Luke	And desired of him letters to Damascus to the synagogues, that if he found any of this way, whether they were men or women, he might bring them bound unto Jerusalem.	3223
Luke	And as he journeyed, he came near Damascus: and suddenly there shined round about him a light from heaven:	3224
Luke	And he fell to the earth, and heard a voice saying unto him, Saul, Saul, why persecutest thou me?	3225
Luke	And he said, Who art thou, Lord?	3226
Luke	And the Lord said, I am Jesus whom thou persecutest: [it is] hard for thee to kick against the pricks.	3227
Luke	And he trembling and astonished said, Lord, what wilt thou have me to do?	3228
Luke	And the Lord [said] unto him, Arise, and go into the city, and it shall be told thee what thou must do.	3229
Luke	And the men which journeyed with him stood speechless, hearing a voice, but seeing no man.	3230
Luke	And Saul arose from the earth; and when his eyes were opened, he saw no man: but they led him by the hand, and brought [him] into Damascus.	3231
Luke	And he was three days without sight, and neither did eat nor drink.	3232
Luke	And there was a certain disciple at Damascus, named Ananias; and to him said the Lord in a vision, Ananias.	3233
Luke	And he said, Behold, I [am here], Lord.	3234
Luke	And the Lord [said] unto him, Arise, and go into the street which is called Straight, and inquire in the house of Judas for [one] called Saul, of Tarsus: for, behold, he prayeth,	3235
Luke	And hath seen in a vision a man named Ananias coming in, and putting [his] hand on him, that he might receive his sight.	3236
Luke	Then Ananias answered, Lord, I have heard by many of this man, how much evil he hath done to thy saints at Jerusalem:	3237
Luke	And here he hath authority from the chief priests to bind all that call on thy name.	3238
Luke	But the Lord said unto him, Go thy way: for he is a chosen vessel unto me, to bear my name before the Gentiles, and kings, and the children of Israel:	3239
Luke	For I will shew him how great things he must suffer for my name’s sake.	3240
Luke	And Ananias went his way, and entered into the house; and putting his hands on him said, Brother Saul, the Lord, [even] Jesus, that appeared unto thee in the way as thou camest, hath sent me, that thou mightest receive thy sight, and be filled with the Holy Ghost.	3241
Luke	And immediately there fell from his eyes as it had been scales: and he received sight forthwith, and arose, and was baptized.	3242
Luke	And when he had received meat, he was strengthened.	3243
Luke	Then was Saul certain days with the disciples which were at Damascus.	3244
Luke	And straightway he preached Christ in the synagogues, that he is the Son of God.	3245
Luke	But all that heard [him] were amazed, and said; Is not this he that destroyed them which called on this name in Jerusalem, and came hither for that intent, that he might bring them bound unto the chief priests?	3246
Luke	But Saul increased the more in strength, and confounded the Jews which dwelt at Damascus, proving that this is very Christ.	3247
Luke	And after that many days were fulfilled, the Jews took counsel to kill him:	3248
Luke	But their laying await was known of Saul.	3249
Luke	And they watched the gates day and night to kill him.	3250
Luke	Then the disciples took him by night, and let [him] down by the wall in a basket.	3251
Luke	And when Saul was come to Jerusalem, he assayed to join himself to the disciples: but they were all afraid of him, and believed not that he was a disciple.	3252
Luke	But Barnabas took him, and brought [him] to the apostles, and declared unto them how he had seen the Lord in the way, and that he had spoken to him, and how he had preached boldly at Damascus in the name of Jesus.	3253
Luke	And he was with them coming in and going out at Jerusalem.	3254
Luke	And he spake boldly in the name of the Lord Jesus, and disputed against the Grecians: but they went about to slay him.	3255
Luke	[Which] when the brethren knew, they brought him down to Caesarea, and sent him forth to Tarsus.	3256
Luke	Then had the churches rest throughout all Judaea and Galilee and Samaria, and were edified; and walking in the fear of the Lord, and in the comfort of the Holy Ghost, were multiplied.	3257
Luke	And it came to pass, as Peter passed throughout all [quarters], he came down also to the saints which dwelt at Lydda.	3258
Luke	And there he found a certain man named AEneas, which had kept his bed eight years, and was sick of the palsy.	3259
Luke	And Peter said unto him, AEneas, Jesus Christ maketh thee whole: arise, and make thy bed.	3260
Luke	And he arose immediately.	3261
Luke	And all that dwelt at Lydda and Saron saw him, and turned to the Lord.	3262
Luke	Now there was at Joppa a certain disciple named Tabitha, which by interpretation is called Dorcas: this woman was full of good works and almsdeeds which she did.	3263
Luke	And it came to pass in those days, that she was sick, and died: whom when they had washed, they laid [her] in an upper chamber.	3264
Luke	And forasmuch as Lydda was nigh to Joppa, and the disciples had heard that Peter was there, they sent unto him two men, desiring [him] that he would not delay to come to them.	3265
Luke	Then Peter arose and went with them.	3266
Luke	When he was come, they brought him into the upper chamber: and all the widows stood by him weeping, and shewing the coats and garments which Dorcas made, while she was with them.	3267
Luke	But Peter put them all forth, and kneeled down, and prayed; and turning [him] to the body said, Tabitha, arise.	3268
Luke	And she opened her eyes: and when she saw Peter, she sat up.	3269
Luke	And he gave her [his] hand, and lifted her up, and when he had called the saints and widows, presented her alive.	3270
Luke	And it was known throughout all Joppa; and many believed in the Lord.	3271
Luke	And it came to pass, that he tarried many days in Joppa with one Simon a tanner.	3272
Luke	There was a certain man in Caesarea called Cornelius, a centurion of the band called the Italian [band],	3273
Luke	[A] devout [man], and one that feared God with all his house, which gave much alms to the people, and prayed to God alway.	3274
Luke	He saw in a vision evidently about the ninth hour of the day an angel of God coming in to him, and saying unto him, Cornelius.	3275
Luke	And when he looked on him, he was afraid, and said, What is it, Lord?	3276
Luke	And he said unto him, Thy prayers and thine alms are come up for a memorial before God.	3277
Luke	And now send men to Joppa, and call for [one] Simon, whose surname is Peter:	3278
Luke	He lodgeth with one Simon a tanner, whose house is by the sea side: he shall tell thee what thou oughtest to do.	3279
Luke	And when the angel which spake unto Cornelius was departed, he called two of his household servants, and a devout soldier of them that waited on him continually;	3280
Luke	And when he had declared all [these] things unto them, he sent them to Joppa.	3281
Luke	On the morrow, as they went on their journey, and drew nigh unto the city, Peter went up upon the housetop to pray about the sixth hour:	3282
Luke	And he became very hungry, and would have eaten: but while they made ready, he fell into a trance,	3283
Luke	And saw heaven opened, and a certain vessel descending unto him, as it had been a great sheet knit at the four corners, and let down to the earth:	3284
Luke	Wherein were all manner of fourfooted beasts of the earth, and wild beasts, and creeping things, and fowls of the air.	3285
Luke	And there came a voice to him, Rise, Peter; kill, and eat.	3286
Luke	But Peter said, Not so, Lord; for I have never eaten any thing that is common or unclean.	3287
Luke	And the voice [spake] unto him again the second time, What God hath cleansed, [that] call not thou common.	3288
Luke	This was done thrice: and the vessel was received up again into heaven.	3289
Luke	Now while Peter doubted in himself what this vision which he had seen should mean, behold, the men which were sent from Cornelius had made inquiry for Simon’s house, and stood before the gate,	3290
Luke	And called, and asked whether Simon, which was surnamed Peter, were lodged there.	3291
Luke	While Peter thought on the vision, the Spirit said unto him, Behold, three men seek thee.	3292
Luke	Arise therefore, and get thee down, and go with them, doubting nothing: for I have sent them.	3293
Luke	Then Peter went down to the men which were sent unto him from Cornelius; and said, Behold, I am he whom ye seek: what [is] the cause wherefore ye are come?	3294
Luke	And they said, Cornelius the centurion, a just man, and one that feareth God, and of good report among all the nation of the Jews, was warned from God by an holy angel to send for thee into his house, and to hear words of thee.	3295
Luke	Then called he them in, and lodged [them].	3296
Luke	And on the morrow Peter went away with them, and certain brethren from Joppa accompanied him.	3297
Luke	And the morrow after they entered into Caesarea.	3298
Luke	And Cornelius waited for them, and had called together his kinsmen and near friends.	3299
Luke	And as Peter was coming in, Cornelius met him, and fell down at his feet, and worshipped [him].	3300
Luke	But Peter took him up, saying, Stand up; I myself also am a man.	3301
Luke	And as he talked with him, he went in, and found many that were come together.	3302
Luke	And he said unto them, Ye know how that it is an unlawful thing for a man that is a Jew to keep company, or come unto one of another nation; but God hath shewed me that I should not call any man common or unclean.	3303
Luke	Therefore came I [unto you] without gainsaying, as soon as I was sent for: I ask therefore for what intent ye have sent for me?	3304
Luke	And Cornelius said, Four days ago I was fasting until this hour; and at the ninth hour I prayed in my house, and, behold, a man stood before me in bright clothing,	3305
Luke	And said, Cornelius, thy prayer is heard, and thine alms are had in remembrance in the sight of God.	3306
Luke	Send therefore to Joppa, and call hither Simon, whose surname is Peter; he is lodged in the house of [one] Simon a tanner by the sea side: who, when he cometh, shall speak unto thee.	3307
Luke	Immediately therefore I sent to thee; and thou hast well done that thou art come.	3308
Luke	Now therefore are we all here present before God, to hear all things that are commanded thee of God.	3309
Luke	Then Peter opened [his] mouth, and said, Of a truth I perceive that God is no respecter of persons:	3310
Luke	But in every nation he that feareth him, and worketh righteousness, is accepted with him.	3311
Luke	The word which [God] sent unto the children of Israel, preaching peace by Jesus Christ: (he is Lord of all:)	3312
Luke	That word, [I say], ye know, which was published throughout all Judaea, and began from Galilee, after the baptism which John preached;	3313
Luke	How God anointed Jesus of Nazareth with the Holy Ghost and with power: who went about doing good, and healing all that were oppressed of the devil; for God was with him.	3314
Luke	And we are witnesses of all things which he did both in the land of the Jews, and in Jerusalem; whom they slew and hanged on a tree:	3315
Luke	Him God raised up the third day, and shewed him openly;	3316
Luke	Not to all the people, but unto witnesses chosen before of God, [even] to us, who did eat and drink with him after he rose from the dead.	3317
Luke	And he commanded us to preach unto the people, and to testify that it is he which was ordained of God [to be] the Judge of quick and dead.	3318
Luke	To him give all the prophets witness, that through his name whosoever believeth in him shall receive remission of sins.	3319
Luke	While Peter yet spake these words, the Holy Ghost fell on all them which heard the word.	3320
Luke	And they of the circumcision which believed were astonished, as many as came with Peter, because that on the Gentiles also was poured out the gift of the Holy Ghost.	3321
Luke	For they heard them speak with tongues, and magnify God.	3322
Luke	Then answered Peter,	3323
Luke	Can any man forbid water, that these should not be baptized, which have received the Holy Ghost as well as we?	3324
Luke	And he commanded them to be baptized in the name of the Lord.	3325
Luke	Then prayed they him to tarry certain days.	3326
Luke	And the apostles and brethren that were in Judaea heard that the Gentiles had also received the word of God.	3327
Luke	And when Peter was come up to Jerusalem, they that were of the circumcision contended with him,	3328
Luke	Saying, Thou wentest in to men uncircumcised, and didst eat with them.	3329
Luke	But Peter rehearsed [the matter] from the beginning, and expounded [it] by order unto them, saying,	3330
Luke	I was in the city of Joppa praying: and in a trance I saw a vision, A certain vessel descend, as it had been a great sheet, let down from heaven by four corners; and it came even to me:	3331
Luke	Upon the which when I had fastened mine eyes, I considered, and saw fourfooted beasts of the earth, and wild beasts, and creeping things, and fowls of the air.	3332
Luke	And I heard a voice saying unto me, Arise, Peter; slay and eat.	3333
Luke	But I said, Not so, Lord: for nothing common or unclean hath at any time entered into my mouth.	3334
Luke	But the voice answered me again from heaven, What God hath cleansed, [that] call not thou common.	3335
Luke	And this was done three times: and all were drawn up again into heaven.	3336
Luke	And, behold, immediately there were three men already come unto the house where I was, sent from Caesarea unto me.	3337
Luke	And the spirit bade me go with them, nothing doubting.	3338
Luke	Moreover these six brethren accompanied me, and we entered into the man’s house:	3339
Luke	And he shewed us how he had seen an angel in his house, which stood and said unto him, Send men to Joppa, and call for Simon, whose surname is Peter;	3340
Luke	Who shall tell thee words, whereby thou and all thy house shall be saved.	3341
Luke	And as I began to speak, the Holy Ghost fell on them, as on us at the beginning.	3342
Luke	Then remembered I the word of the Lord, how that he said, John indeed baptized with water; but ye shall be baptized with the Holy Ghost.	3343
Luke	Forasmuch then as God gave them the like gift as [he did] unto us, who believed on the Lord Jesus Christ; what was I, that I could withstand God?	3344
Luke	When they heard these things, they held their peace, and glorified God, saying, Then hath God also to the Gentiles granted repentance unto life.	3345
Luke	Now they which were scattered abroad upon the persecution that arose about Stephen travelled as far as Phenice, and Cyprus, and Antioch, preaching the word to none but unto the Jews only.	3346
Luke	And some of them were men of Cyprus and Cyrene, which, when they were come to Antioch, spake unto the Grecians, preaching the Lord Jesus.	3347
Luke	And the hand of the Lord was with them: and a great number believed, and turned unto the Lord.	3348
Luke	Then tidings of these things came unto the ears of the church which was in Jerusalem: and they sent forth Barnabas, that he should go as far as Antioch.	3349
Luke	Who, when he came, and had seen the grace of God, was glad, and exhorted them all, that with purpose of heart they would cleave unto the Lord.	3350
Luke	For he was a good man, and full of the Holy Ghost and of faith: and much people was added unto the Lord.	3351
Luke	Then departed Barnabas to Tarsus, for to seek Saul:	3352
Luke	And when he had found him, he brought him unto Antioch.	3353
Luke	And it came to pass, that a whole year they assembled themselves with the church, and taught much people.	3354
Luke	And the disciples were called Christians first in Antioch.	3355
Luke	And in these days came prophets from Jerusalem unto Antioch.	3356
Luke	And there stood up one of them named Agabus, and signified by the spirit that there should be great dearth throughout all the world: which came to pass in the days of Claudius Caesar.	3357
