label	text	textid
Matthew	The book of the generation of Jesus Christ, the son of David, the son of Abraham.	0
Matthew	Abraham begat Isaac; and Isaac begat Jacob; and Jacob begat Judas and his brethren;	1
Matthew	And Judas begat Phares and Zara of Thamar; and Phares begat Esrom; and Esrom begat Aram;	2
Matthew	And Aram begat Aminadab; and Aminadab begat Naasson; and Naasson begat Salmon;	3
Matthew	And Salmon begat Booz of Rachab; and Booz begat Obed of Ruth; and Obed begat Jesse;	4
Matthew	And Jesse begat David the king; and David the king begat Solomon of her [that had been the wife] of Urias;	5
Matthew	And Solomon begat Roboam; and Roboam begat Abia; and Abia begat Asa;	6
Matthew	And Asa begat Josaphat; and Josaphat begat Joram; and Joram begat Ozias;	7
Matthew	And Ozias begat Joatham; and Joatham begat Achaz; and Achaz begat Ezekias;	8
Matthew	And Ezekias begat Manasses; and Manasses begat Amon; and Amon begat Josias;	9
Matthew	And Josias begat Jechonias and his brethren, about the time they were carried away to Babylon:	10
Matthew	And after they were brought to Babylon, Jechonias begat Salathiel; and Salathiel begat Zorobabel;	11
Matthew	And Zorobabel begat Abiud; and Abiud begat Eliakim; and Eliakim begat Azor;	12
Matthew	And Azor begat Sadoc; and Sadoc begat Achim; and Achim begat Eliud;	13
Matthew	And Eliud begat Eleazar; and Eleazar begat Matthan; and Matthan begat Jacob;	14
Matthew	And Jacob begat Joseph the husband of Mary, of whom was born Jesus, who is called Christ.	15
Matthew	So all the generations from Abraham to David [are] fourteen generations; and from David until the carrying away into Babylon [are] fourteen generations; and from the carrying away into Babylon unto Christ [are] fourteen generations.	16
Matthew	Now the birth of Jesus Christ was on this wise: When as his mother Mary was espoused to Joseph, before they came together, she was found with child of the Holy Ghost.	17
Matthew	Then Joseph her husband, being a just [man], and not willing to make her a publick example, was minded to put her away privily.	18
Matthew	But while he thought on these things, behold, the angel of the Lord appeared unto him in a dream, saying, Joseph, thou son of David, fear not to take unto thee Mary thy wife: for that which is conceived in her is of the Holy Ghost.	19
Matthew	And she shall bring forth a son, and thou shalt call his name JESUS: for he shall save his people from their sins.	20
Matthew	Now all this was done, that it might be fulfilled which was spoken of the Lord by the prophet, saying,	21
Matthew	Behold, a virgin shall be with child, and shall bring forth a son, and they shall call his name Emmanuel, which being interpreted is, God with us.	22
Matthew	Then Joseph being raised from sleep did as the angel of the Lord had bidden him, and took unto him his wife:	23
Matthew	And knew her not till she had brought forth her firstborn son: and he called his name JESUS.	24
Matthew	Now when Jesus was born in Bethlehem of Judaea in the days of Herod the king, behold, there came wise men from the east to Jerusalem,	25
Matthew	Saying, Where is he that is born King of the Jews?	26
Matthew	for we have seen his star in the east, and are come to worship him.	27
Matthew	When Herod the king had heard [these things], he was troubled, and all Jerusalem with him.	28
Matthew	And when he had gathered all the chief priests and scribes of the people together, he demanded of them where Christ should be born.	29
Matthew	And they said unto him, In Bethlehem of Judaea: for thus it is written by the prophet,	30
Matthew	And thou Bethlehem, [in] the land of Juda, art not the least among the princes of Juda: for out of thee shall come a Governor, that shall rule my people Israel.	31
Matthew	Then Herod, when he had privily called the wise men, inquired of them diligently what time the star appeared.	32
Matthew	And he sent them to Bethlehem, and said, Go and search diligently for the young child; and when ye have found [him], bring me word again, that I may come and worship him also.	33
Matthew	When they had heard the king, they departed; and, lo, the star, which they saw in the east, went before them, till it came and stood over where the young child was.	34
Matthew	When they saw the star, they rejoiced with exceeding great joy.	35
Matthew	And when they were come into the house, they saw the young child with Mary his mother, and fell down, and worshipped him: and when they had opened their treasures, they presented unto him gifts; gold, and frankincense, and myrrh.	36
Matthew	And being warned of God in a dream that they should not return to Herod, they departed into their own country another way.	37
Matthew	And when they were departed, behold, the angel of the Lord appeareth to Joseph in a dream, saying, Arise, and take the young child and his mother, and flee into Egypt, and be thou there until I bring thee word: for Herod will seek the young child to destroy him.	38
Matthew	When he arose, he took the young child and his mother by night, and departed into Egypt:	39
Matthew	And was there until the death of Herod: that it might be fulfilled which was spoken of the Lord by the prophet, saying, Out of Egypt have I called my son.	40
Matthew	Then Herod, when he saw that he was mocked of the wise men, was exceeding wroth, and sent forth, and slew all the children that were in Bethlehem, and in all the coasts thereof, from two years old and under, according to the time which he had diligently inquired of the wise men.	41
Matthew	Then was fulfilled that which was spoken by Jeremy the prophet, saying,	42
Matthew	In Rama was there a voice heard, lamentation, and weeping, and great mourning, Rachel weeping [for] her children, and would not be comforted, because they are not.	43
Matthew	But when Herod was dead, behold, an angel of the Lord appeareth in a dream to Joseph in Egypt,	44
Matthew	Saying, Arise, and take the young child and his mother, and go into the land of Israel: for they are dead which sought the young child’s life.	45
Matthew	And he arose, and took the young child and his mother, and came into the land of Israel.	46
Matthew	But when he heard that Archelaus did reign in Judaea in the room of his father Herod, he was afraid to go thither: notwithstanding, being warned of God in a dream, he turned aside into the parts of Galilee:	47
Matthew	And he came and dwelt in a city called Nazareth: that it might be fulfilled which was spoken by the prophets, He shall be called a Nazarene.	48
Matthew	In those days came John the Baptist, preaching in the wilderness of Judaea,	49
Matthew	And saying, Repent ye: for the kingdom of heaven is at hand.	50
Matthew	For this is he that was spoken of by the prophet Esaias, saying, The voice of one crying in the wilderness, Prepare ye the way of the Lord, make his paths straight.	51
Matthew	And the same John had his raiment of camel’s hair, and a leathern girdle about his loins; and his meat was locusts and wild honey.	52
Matthew	Then went out to him Jerusalem, and all Judaea, and all the region round about Jordan,	53
Matthew	And were baptized of him in Jordan, confessing their sins.	54
Matthew	But when he saw many of the Pharisees and Sadducees come to his baptism, he said unto them, O generation of vipers, who hath warned you to flee from the wrath to come?	55
Matthew	Bring forth therefore fruits meet for repentance:	56
Matthew	And think not to say within yourselves, We have Abraham to [our] father: for I say unto you, that God is able of these stones to raise up children unto Abraham.	57
Matthew	And now also the axe is laid unto the root of the trees: therefore every tree which bringeth not forth good fruit is hewn down, and cast into the fire.	58
Matthew	I indeed baptize you with water unto repentance: but he that cometh after me is mightier than I, whose shoes I am not worthy to bear: he shall baptize you with the Holy Ghost, and [with] fire:	59
Matthew	Whose fan [is] in his hand, and he will throughly purge his floor, and gather his wheat into the garner; but he will burn up the chaff with unquenchable fire.	60
Matthew	Then cometh Jesus from Galilee to Jordan unto John, to be baptized of him.	61
Matthew	But John forbad him, saying, I have need to be baptized of thee, and comest thou to me?	62
Matthew	And Jesus answering said unto him, Suffer [it to be so] now: for thus it becometh us to fulfil all righteousness.	63
Matthew	Then he suffered him.	64
Matthew	And Jesus, when he was baptized, went up straightway out of the water: and, lo, the heavens were opened unto him, and he saw the Spirit of God descending like a dove, and lighting upon him:	65
Matthew	And lo a voice from heaven, saying, This is my beloved Son, in whom I am well pleased.	66
Matthew	Then was Jesus led up of the Spirit into the wilderness to be tempted of the devil.	67
Matthew	And when he had fasted forty days and forty nights, he was afterward an hungred.	68
Matthew	And when the tempter came to him, he said, If thou be the Son of God, command that these stones be made bread.	69
Matthew	But he answered and said, It is written, Man shall not live by bread alone, but by every word that proceedeth out of the mouth of God.	70
Matthew	Then the devil taketh him up into the holy city, and setteth him on a pinnacle of the temple,	71
Matthew	And saith unto him, If thou be the Son of God, cast thyself down: for it is written, He shall give his angels charge concerning thee: and in [their] hands they shall bear thee up, lest at any time thou dash thy foot against a stone.	72
Matthew	Jesus said unto him, It is written again, Thou shalt not tempt the Lord thy God.	73
Matthew	Again, the devil taketh him up into an exceeding high mountain, and sheweth him all the kingdoms of the world, and the glory of them;	74
Matthew	And saith unto him, All these things will I give thee, if thou wilt fall down and worship me.	75
Matthew	Then saith Jesus unto him, Get thee hence, Satan: for it is written, Thou shalt worship the Lord thy God, and him only shalt thou serve.	76
Matthew	Then the devil leaveth him, and, behold, angels came and ministered unto him.	77
Matthew	Now when Jesus had heard that John was cast into prison, he departed into Galilee;	78
Matthew	And leaving Nazareth, he came and dwelt in Capernaum, which is upon the sea coast, in the borders of Zabulon and Nephthalim:	79
Matthew	That it might be fulfilled which was spoken by Esaias the prophet, saying,	80
Matthew	The land of Zabulon, and the land of Nephthalim, [by] the way of the sea, beyond Jordan, Galilee of the Gentiles;	81
Matthew	The people which sat in darkness saw great light; and to them which sat in the region and shadow of death light is sprung up.	82
Matthew	From that time Jesus began to preach, and to say, Repent: for the kingdom of heaven is at hand.	83
Matthew	And Jesus, walking by the sea of Galilee, saw two brethren, Simon called Peter, and Andrew his brother, casting a net into the sea: for they were fishers.	84
Matthew	And he saith unto them, Follow me, and I will make you fishers of men.	85
Matthew	And they straightway left [their] nets, and followed him.	86
Matthew	And going on from thence, he saw other two brethren, James [the son] of Zebedee, and John his brother, in a ship with Zebedee their father, mending their nets; and he called them.	87
Matthew	And they immediately left the ship and their father, and followed him.	88
Matthew	And Jesus went about all Galilee, teaching in their synagogues, and preaching the gospel of the kingdom, and healing all manner of sickness and all manner of disease among the people.	89
Matthew	And his fame went throughout all Syria: and they brought unto him all sick people that were taken with divers diseases and torments, and those which were possessed with devils, and those which were lunatick, and those that had the palsy; and he healed them.	90
Matthew	And there followed him great multitudes of people from Galilee, and [from] Decapolis, and [from] Jerusalem, and [from] Judaea, and [from] beyond Jordan.	91
Matthew	And seeing the multitudes, he went up into a mountain: and when he was set, his disciples came unto him:	92
Matthew	And he opened his mouth, and taught them, saying,	93
Matthew	Blessed [are] the poor in spirit: for theirs is the kingdom of heaven.	94
Matthew	Blessed [are] they that mourn: for they shall be comforted.	95
Matthew	Blessed [are] the meek: for they shall inherit the earth.	96
Matthew	Blessed [are] they which do hunger and thirst after righteousness: for they shall be filled.	97
Matthew	Blessed [are] the merciful: for they shall obtain mercy.	98
Matthew	Blessed [are] the pure in heart: for they shall see God.	99
Matthew	Blessed [are] the peacemakers: for they shall be called the children of God.	100
Matthew	Blessed [are] they which are persecuted for righteousness’ sake: for theirs is the kingdom of heaven.	101
Matthew	Blessed are ye, when [men] shall revile you, and persecute [you], and shall say all manner of evil against you falsely, for my sake.	102
Matthew	Rejoice, and be exceeding glad: for great [is] your reward in heaven: for so persecuted they the prophets which were before you.	103
Matthew	Ye are the salt of the earth: but if the salt have lost his savour, wherewith shall it be salted?	104
Matthew	it is thenceforth good for nothing, but to be cast out, and to be trodden under foot of men.	105
Matthew	Ye are the light of the world.	106
Matthew	A city that is set on an hill cannot be hid.	107
Matthew	Neither do men light a candle, and put it under a bushel, but on a candlestick; and it giveth light unto all that are in the house.	108
Matthew	Let your light so shine before men, that they may see your good works, and glorify your Father which is in heaven.	109
Matthew	Think not that I am come to destroy the law, or the prophets: I am not come to destroy, but to fulfil.	110
Matthew	For verily I say unto you, Till heaven and earth pass, one jot or one tittle shall in no wise pass from the law, till all be fulfilled.	111
Matthew	Whosoever therefore shall break one of these least commandments, and shall teach men so, he shall be called the least in the kingdom of heaven: but whosoever shall do and teach [them], the same shall be called great in the kingdom of heaven.	112
Matthew	For I say unto you, That except your righteousness shall exceed [the righteousness] of the scribes and Pharisees, ye shall in no case enter into the kingdom of heaven.	113
Matthew	Ye have heard that it was said by them of old time, Thou shalt not kill; and whosoever shall kill shall be in danger of the judgment:	114
Matthew	But I say unto you, That whosoever is angry with his brother without a cause shall be in danger of the judgment: and whosoever shall say to his brother, Raca, shall be in danger of the council: but whosoever shall say, Thou fool, shall be in danger of hell fire.	115
Matthew	Therefore if thou bring thy gift to the altar, and there rememberest that thy brother hath ought against thee;	116
Matthew	Leave there thy gift before the altar, and go thy way; first be reconciled to thy brother, and then come and offer thy gift.	117
Matthew	Agree with thine adversary quickly, whiles thou art in the way with him; lest at any time the adversary deliver thee to the judge, and the judge deliver thee to the officer, and thou be cast into prison.	118
Matthew	Verily I say unto thee, Thou shalt by no means come out thence, till thou hast paid the uttermost farthing.	119
Matthew	Ye have heard that it was said by them of old time, Thou shalt not commit adultery:	120
Matthew	But I say unto you, That whosoever looketh on a woman to lust after her hath committed adultery with her already in his heart.	121
Matthew	And if thy right eye offend thee, pluck it out, and cast [it] from thee: for it is profitable for thee that one of thy members should perish, and not [that] thy whole body should be cast into hell.	122
Matthew	And if thy right hand offend thee, cut it off, and cast [it] from thee: for it is profitable for thee that one of thy members should perish, and not [that] thy whole body should be cast into hell.	123
Matthew	It hath been said, Whosoever shall put away his wife, let him give her a writing of divorcement:	124
Matthew	But I say unto you, That whosoever shall put away his wife, saving for the cause of fornication, causeth her to commit adultery: and whosoever shall marry her that is divorced committeth adultery.	125
Matthew	Again, ye have heard that it hath been said by them of old time, Thou shalt not forswear thyself, but shalt perform unto the Lord thine oaths:	126
Matthew	But I say unto you, Swear not at all; neither by heaven; for it is God’s throne:	127
Matthew	Nor by the earth; for it is his footstool: neither by Jerusalem; for it is the city of the great King.	128
Matthew	Neither shalt thou swear by thy head, because thou canst not make one hair white or black.	129
Matthew	But let your communication be, Yea, yea; Nay, nay: for whatsoever is more than these cometh of evil.	130
Matthew	Ye have heard that it hath been said, An eye for an eye, and a tooth for a tooth:	131
Matthew	But I say unto you, That ye resist not evil: but whosoever shall smite thee on thy right cheek, turn to him the other also.	132
Matthew	And if any man will sue thee at the law, and take away thy coat, let him have [thy] cloke also.	133
Matthew	And whosoever shall compel thee to go a mile, go with him twain.	134
Matthew	Give to him that asketh thee, and from him that would borrow of thee turn not thou away.	135
Matthew	Ye have heard that it hath been said, Thou shalt love thy neighbour, and hate thine enemy.	136
Matthew	But I say unto you, Love your enemies, bless them that curse you, do good to them that hate you, and pray for them which despitefully use you, and persecute you;	137
Matthew	That ye may be the children of your Father which is in heaven: for he maketh his sun to rise on the evil and on the good, and sendeth rain on the just and on the unjust.	138
Matthew	For if ye love them which love you, what reward have ye?	139
Matthew	do not even the publicans the same?	140
Matthew	And if ye salute your brethren only, what do ye more [than others]?	141
Matthew	do not even the publicans so?	142
Matthew	Be ye therefore perfect, even as your Father which is in heaven is perfect.	143
Matthew	Take heed that ye do not your alms before men, to be seen of them: otherwise ye have no reward of your Father which is in heaven.	144
Matthew	Therefore when thou doest [thine] alms, do not sound a trumpet before thee, as the hypocrites do in the synagogues and in the streets, that they may have glory of men.	145
Matthew	Verily I say unto you, They have their reward.	146
Matthew	But when thou doest alms, let not thy left hand know what thy right hand doeth:	147
Matthew	That thine alms may be in secret: and thy Father which seeth in secret himself shall reward thee openly.	148
Matthew	And when thou prayest, thou shalt not be as the hypocrites [are]: for they love to pray standing in the synagogues and in the corners of the streets, that they may be seen of men.	149
Matthew	Verily I say unto you, They have their reward.	150
Matthew	But thou, when thou prayest, enter into thy closet, and when thou hast shut thy door, pray to thy Father which is in secret; and thy Father which seeth in secret shall reward thee openly.	151
Matthew	But when ye pray, use not vain repetitions, as the heathen [do]: for they think that they shall be heard for their much speaking.	152
Matthew	Be not ye therefore like unto them: for your Father knoweth what things ye have need of, before ye ask him.	153
Matthew	After this manner therefore pray ye: Our Father which art in heaven, Hallowed be thy name.	154
Matthew	Thy kingdom come.	155
Matthew	Thy will be done in earth, as [it is] in heaven.	156
Matthew	Give us this day our daily bread.	157
Matthew	And forgive us our debts, as we forgive our debtors.	158
Matthew	And lead us not into temptation, but deliver us from evil: For thine is the kingdom, and the power, and the glory, for ever.	159
Matthew	Amen.	160
Matthew	For if ye forgive men their trespasses, your heavenly Father will also forgive you:	161
Matthew	But if ye forgive not men their trespasses, neither will your Father forgive your trespasses.	162
Matthew	Moreover when ye fast, be not, as the hypocrites, of a sad countenance: for they disfigure their faces, that they may appear unto men to fast.	163
Matthew	Verily I say unto you, They have their reward.	164
Matthew	But thou, when thou fastest, anoint thine head, and wash thy face;	165
Matthew	That thou appear not unto men to fast, but unto thy Father which is in secret: and thy Father, which seeth in secret, shall reward thee openly.	166
Matthew	Lay not up for yourselves treasures upon earth, where moth and rust doth corrupt, and where thieves break through and steal:	167
Matthew	But lay up for yourselves treasures in heaven, where neither moth nor rust doth corrupt, and where thieves do not break through nor steal:	168
Matthew	For where your treasure is, there will your heart be also.	169
Matthew	The light of the body is the eye: if therefore thine eye be single, thy whole body shall be full of light.	170
Matthew	But if thine eye be evil, thy whole body shall be full of darkness.	171
Matthew	If therefore the light that is in thee be darkness, how great [is] that darkness!	172
Matthew	No man can serve two masters: for either he will hate the one, and love the other; or else he will hold to the one, and despise the other.	173
Matthew	Ye cannot serve God and mammon.	174
Matthew	Therefore I say unto you, Take no thought for your life, what ye shall eat, or what ye shall drink; nor yet for your body, what ye shall put on.	175
Matthew	Is not the life more than meat, and the body than raiment?	176
Matthew	Behold the fowls of the air: for they sow not, neither do they reap, nor gather into barns; yet your heavenly Father feedeth them.	177
Matthew	Are ye not much better than they?	178
Matthew	Which of you by taking thought can add one cubit unto his stature?	179
Matthew	And why take ye thought for raiment?	180
Matthew	Consider the lilies of the field, how they grow; they toil not, neither do they spin:	181
Matthew	And yet I say unto you, That even Solomon in all his glory was not arrayed like one of these.	182
Matthew	Wherefore, if God so clothe the grass of the field, which to day is, and to morrow is cast into the oven, [shall he] not much more [clothe] you, O ye of little faith?	183
Matthew	Therefore take no thought, saying, What shall we eat?	184
Matthew	or, What shall we drink?	185
Matthew	or, Wherewithal shall we be clothed?	186
Matthew	(For after all these things do the Gentiles seek:) for your heavenly Father knoweth that ye have need of all these things.	187
Matthew	But seek ye first the kingdom of God, and his righteousness; and all these things shall be added unto you.	188
Matthew	Take therefore no thought for the morrow: for the morrow shall take thought for the things of itself.	189
Matthew	Sufficient unto the day [is] the evil thereof.	190
Matthew	Judge not, that ye be not judged.	191
Matthew	For with what judgment ye judge, ye shall be judged: and with what measure ye mete, it shall be measured to you again.	192
Matthew	And why beholdest thou the mote that is in thy brother’s eye, but considerest not the beam that is in thine own eye?	193
Matthew	Or how wilt thou say to thy brother, Let me pull out the mote out of thine eye; and, behold, a beam [is] in thine own eye?	194
Matthew	Thou hypocrite, first cast out the beam out of thine own eye; and then shalt thou see clearly to cast out the mote out of thy brother’s eye.	195
Matthew	Give not that which is holy unto the dogs, neither cast ye your pearls before swine, lest they trample them under their feet, and turn again and rend you.	196
Matthew	Ask, and it shall be given you; seek, and ye shall find; knock, and it shall be opened unto you:	197
Matthew	For every one that asketh receiveth; and he that seeketh findeth; and to him that knocketh it shall be opened.	198
Matthew	Or what man is there of you, whom if his son ask bread, will he give him a stone?	199
Matthew	Or if he ask a fish, will he give him a serpent?	200
Matthew	If ye then, being evil, know how to give good gifts unto your children, how much more shall your Father which is in heaven give good things to them that ask him?	201
Matthew	Therefore all things whatsoever ye would that men should do to you, do ye even so to them: for this is the law and the prophets.	202
Matthew	Enter ye in at the strait gate: for wide [is] the gate, and broad [is] the way, that leadeth to destruction, and many there be which go in thereat:	203
Matthew	Because strait [is] the gate, and narrow [is] the way, which leadeth unto life, and few there be that find it.	204
Matthew	Beware of false prophets, which come to you in sheep’s clothing, but inwardly they are ravening wolves.	205
Matthew	Ye shall know them by their fruits.	206
Matthew	Do men gather grapes of thorns, or figs of thistles?	207
Matthew	Even so every good tree bringeth forth good fruit; but a corrupt tree bringeth forth evil fruit.	208
Matthew	A good tree cannot bring forth evil fruit, neither [can] a corrupt tree bring forth good fruit.	209
Matthew	Every tree that bringeth not forth good fruit is hewn down, and cast into the fire.	210
Matthew	Wherefore by their fruits ye shall know them.	211
Matthew	Not every one that saith unto me, Lord, Lord, shall enter into the kingdom of heaven; but he that doeth the will of my Father which is in heaven.	212
Matthew	Many will say to me in that day, Lord, Lord, have we not prophesied in thy name?	213
Matthew	and in thy name have cast out devils?	214
Matthew	and in thy name done many wonderful works?	215
Matthew	And then will I profess unto them, I never knew you: depart from me, ye that work iniquity.	216
