label	text	textid
Mark	For false Christs and false prophets shall rise, and shall shew signs and wonders, to seduce, if [it were] possible, even the elect.	1577
Mark	But take ye heed: behold, I have foretold you all things.	1578
Mark	But in those days, after that tribulation, the sun shall be darkened, and the moon shall not give her light,	1579
Mark	And the stars of heaven shall fall, and the powers that are in heaven shall be shaken.	1580
Mark	And then shall they see the Son of man coming in the clouds with great power and glory.	1581
Mark	And then shall he send his angels, and shall gather together his elect from the four winds, from the uttermost part of the earth to the uttermost part of heaven.	1582
Mark	Now learn a parable of the fig tree; When her branch is yet tender, and putteth forth leaves, ye know that summer is near:	1583
Mark	So ye in like manner, when ye shall see these things come to pass, know that it is nigh, [even] at the doors.	1584
Mark	Verily I say unto you, that this generation shall not pass, till all these things be done.	1585
Mark	Heaven and earth shall pass away: but my words shall not pass away.	1586
Mark	But of that day and [that] hour knoweth no man, no, not the angels which are in heaven, neither the Son, but the Father.	1587
Mark	Take ye heed, watch and pray: for ye know not when the time is.	1588
Mark	[For the Son of man is] as a man taking a far journey, who left his house, and gave authority to his servants, and to every man his work, and commanded the porter to watch.	1589
Mark	Watch ye therefore: for ye know not when the master of the house cometh, at even, or at midnight, or at the cockcrowing, or in the morning:	1590
Mark	Lest coming suddenly he find you sleeping.	1591
Mark	And what I say unto you I say unto all, Watch.	1592
Mark	After two days was [the feast of] the passover, and of unleavened bread: and the chief priests and the scribes sought how they might take him by craft, and put [him] to death.	1593
Mark	But they said, Not on the feast [day], lest there be an uproar of the people.	1594
Mark	And being in Bethany in the house of Simon the leper, as he sat at meat, there came a woman having an alabaster box of ointment of spikenard very precious; and she brake the box, and poured [it] on his head.	1595
Mark	And there were some that had indignation within themselves, and said, Why was this waste of the ointment made?	1596
Luke	Forasmuch as many have taken in hand to set forth in order a declaration of those things which are most surely believed among us,	1597
Luke	Even as they delivered them unto us, which from the beginning were eyewitnesses, and ministers of the word;	1598
Luke	It seemed good to me also, having had perfect understanding of all things from the very first, to write unto thee in order, most excellent Theophilus,	1599
Luke	That thou mightest know the certainty of those things, wherein thou hast been instructed.	1600
Luke	There was in the days of Herod, the king of Judaea, a certain priest named Zacharias, of the course of Abia: and his wife [was] of the daughters of Aaron, and her name [was] Elisabeth.	1601
Luke	And they were both righteous before God, walking in all the commandments and ordinances of the Lord blameless.	1602
Luke	And they had no child, because that Elisabeth was barren, and they both were [now] well stricken in years.	1603
Luke	And it came to pass, that while he executed the priest’s office before God in the order of his course,	1604
Luke	According to the custom of the priest’s office, his lot was to burn incense when he went into the temple of the Lord.	1605
Luke	And the whole multitude of the people were praying without at the time of incense.	1606
Luke	And there appeared unto him an angel of the Lord standing on the right side of the altar of incense.	1607
Luke	And when Zacharias saw [him], he was troubled, and fear fell upon him.	1608
Luke	But the angel said unto him, Fear not, Zacharias: for thy prayer is heard; and thy wife Elisabeth shall bear thee a son, and thou shalt call his name John.	1609
Luke	And thou shalt have joy and gladness; and many shall rejoice at his birth.	1610
Luke	For he shall be great in the sight of the Lord, and shall drink neither wine nor strong drink; and he shall be filled with the Holy Ghost, even from his mother’s womb.	1611
Luke	And many of the children of Israel shall he turn to the Lord their God.	1612
Luke	And he shall go before him in the spirit and power of Elias, to turn the hearts of the fathers to the children, and the disobedient to the wisdom of the just; to make ready a people prepared for the Lord.	1613
Luke	And Zacharias said unto the angel, Whereby shall I know this?	1614
Luke	for I am an old man, and my wife well stricken in years.	1615
Luke	And the angel answering said unto him, I am Gabriel, that stand in the presence of God; and am sent to speak unto thee, and to shew thee these glad tidings.	1616
Luke	And, behold, thou shalt be dumb, and not able to speak, until the day that these things shall be performed, because thou believest not my words, which shall be fulfilled in their season.	1617
Luke	And the people waited for Zacharias, and marvelled that he tarried so long in the temple.	1618
Luke	And when he came out, he could not speak unto them: and they perceived that he had seen a vision in the temple: for he beckoned unto them, and remained speechless.	1619
Luke	And it came to pass, that, as soon as the days of his ministration were accomplished, he departed to his own house.	1620
Luke	And after those days his wife Elisabeth conceived, and hid herself five months, saying,	1621
Luke	Thus hath the Lord dealt with me in the days wherein he looked on [me], to take away my reproach among men.	1622
Luke	And in the sixth month the angel Gabriel was sent from God unto a city of Galilee, named Nazareth,	1623
Luke	To a virgin espoused to a man whose name was Joseph, of the house of David; and the virgin’s name [was] Mary.	1624
Luke	And the angel came in unto her, and said, Hail, [thou that art] highly favoured, the Lord [is] with thee: blessed [art] thou among women.	1625
Luke	And when she saw [him], she was troubled at his saying, and cast in her mind what manner of salutation this should be.	1626
Luke	And the angel said unto her, Fear not, Mary: for thou hast found favour with God.	1627
Luke	And, behold, thou shalt conceive in thy womb, and bring forth a son, and shalt call his name JESUS.	1628
Luke	He shall be great, and shall be called the Son of the Highest: and the Lord God shall give unto him the throne of his father David:	1629
Luke	And he shall reign over the house of Jacob for ever; and of his kingdom there shall be no end.	1630
Luke	Then said Mary unto the angel, How shall this be, seeing I know not a man?	1631
Luke	And the angel answered and said unto her, The Holy Ghost shall come upon thee, and the power of the Highest shall overshadow thee: therefore also that holy thing which shall be born of thee shall be called the Son of God.	1632
Luke	And, behold, thy cousin Elisabeth, she hath also conceived a son in her old age: and this is the sixth month with her, who was called barren.	1633
Luke	For with God nothing shall be impossible.	1634
Luke	And Mary said, Behold the handmaid of the Lord; be it unto me according to thy word.	1635
Luke	And the angel departed from her.	1636
Luke	And Mary arose in those days, and went into the hill country with haste, into a city of Juda;	1637
Luke	And entered into the house of Zacharias, and saluted Elisabeth.	1638
Luke	And it came to pass, that, when Elisabeth heard the salutation of Mary, the babe leaped in her womb; and Elisabeth was filled with the Holy Ghost:	1639
Luke	And she spake out with a loud voice, and said, Blessed [art] thou among women, and blessed [is] the fruit of thy womb.	1640
Luke	And whence [is] this to me, that the mother of my Lord should come to me?	1641
Luke	For, lo, as soon as the voice of thy salutation sounded in mine ears, the babe leaped in my womb for joy.	1642
Luke	And blessed [is] she that believed: for there shall be a performance of those things which were told her from the Lord.	1643
Luke	And Mary said, My soul doth magnify the Lord,	1644
Luke	And my spirit hath rejoiced in God my Saviour.	1645
Luke	For he hath regarded the low estate of his handmaiden: for, behold, from henceforth all generations shall call me blessed.	1646
Luke	For he that is mighty hath done to me great things; and holy [is] his name.	1647
Luke	And his mercy [is] on them that fear him from generation to generation.	1648
Luke	He hath shewed strength with his arm; he hath scattered the proud in the imagination of their hearts.	1649
Luke	He hath put down the mighty from [their] seats, and exalted them of low degree.	1650
Luke	He hath filled the hungry with good things; and the rich he hath sent empty away.	1651
Luke	He hath holpen his servant Israel, in remembrance of [his] mercy;	1652
Luke	As he spake to our fathers, to Abraham, and to his seed for ever.	1653
Luke	And Mary abode with her about three months, and returned to her own house.	1654
Luke	Now Elisabeth’s full time came that she should be delivered; and she brought forth a son.	1655
Luke	And her neighbours and her cousins heard how the Lord had shewed great mercy upon her; and they rejoiced with her.	1656
Luke	And it came to pass, that on the eighth day they came to circumcise the child; and they called him Zacharias, after the name of his father.	1657
Luke	And his mother answered and said, Not [so]; but he shall be called John.	1658
Luke	And they said unto her, There is none of thy kindred that is called by this name.	1659
Luke	And they made signs to his father, how he would have him called.	1660
Luke	And he asked for a writing table, and wrote, saying, His name is John.	1661
Luke	And they marvelled all.	1662
Luke	And his mouth was opened immediately, and his tongue [loosed], and he spake, and praised God.	1663
Luke	And fear came on all that dwelt round about them: and all these sayings were noised abroad throughout all the hill country of Judaea.	1664
Luke	And all they that heard [them] laid [them] up in their hearts, saying, What manner of child shall this be!	1665
Luke	And the hand of the Lord was with him.	1666
Luke	And his father Zacharias was filled with the Holy Ghost, and prophesied, saying,	1667
Luke	Blessed [be] the Lord God of Israel; for he hath visited and redeemed his people,	1668
Luke	And hath raised up an horn of salvation for us in the house of his servant David;	1669
Luke	As he spake by the mouth of his holy prophets, which have been since the world began:	1670
Luke	That we should be saved from our enemies, and from the hand of all that hate us;	1671
Luke	To perform the mercy [promised] to our fathers, and to remember his holy covenant;	1672
Luke	The oath which he sware to our father Abraham,	1673
Luke	That he would grant unto us, that we being delivered out of the hand of our enemies might serve him without fear,	1674
Luke	In holiness and righteousness before him, all the days of our life.	1675
Luke	And thou, child, shalt be called the prophet of the Highest: for thou shalt go before the face of the Lord to prepare his ways;	1676
Luke	To give knowledge of salvation unto his people by the remission of their sins,	1677
Luke	Through the tender mercy of our God; whereby the dayspring from on high hath visited us,	1678
Luke	To give light to them that sit in darkness and [in] the shadow of death, to guide our feet into the way of peace.	1679
Luke	And the child grew, and waxed strong in spirit, and was in the deserts till the day of his shewing unto Israel.	1680
Luke	And it came to pass in those days, that there went out a decree from Caesar Augustus, that all the world should be taxed.	1681
Luke	([And] this taxing was first made when Cyrenius was governor of Syria.)	1682
Luke	And all went to be taxed, every one into his own city.	1683
Luke	And Joseph also went up from Galilee, out of the city of Nazareth, into Judaea, unto the city of David, which is called Bethlehem; (because he was of the house and lineage of David:)	1684
Luke	To be taxed with Mary his espoused wife, being great with child.	1685
Luke	And so it was, that, while they were there, the days were accomplished that she should be delivered.	1686
Luke	And she brought forth her firstborn son, and wrapped him in swaddling clothes, and laid him in a manger; because there was no room for them in the inn.	1687
Luke	And there were in the same country shepherds abiding in the field, keeping watch over their flock by night.	1688
Luke	And, lo, the angel of the Lord came upon them, and the glory of the Lord shone round about them: and they were sore afraid.	1689
Luke	And the angel said unto them, Fear not: for, behold, I bring you good tidings of great joy, which shall be to all people.	1690
Luke	For unto you is born this day in the city of David a Saviour, which is Christ the Lord.	1691
Luke	And this [shall be] a sign unto you; Ye shall find the babe wrapped in swaddling clothes, lying in a manger.	1692
Luke	And suddenly there was with the angel a multitude of the heavenly host praising God, and saying,	1693
Luke	Glory to God in the highest, and on earth peace, good will toward men.	1694
Luke	And it came to pass, as the angels were gone away from them into heaven, the shepherds said one to another, Let us now go even unto Bethlehem, and see this thing which is come to pass, which the Lord hath made known unto us.	1695
Luke	And they came with haste, and found Mary, and Joseph, and the babe lying in a manger.	1696
Luke	And when they had seen [it], they made known abroad the saying which was told them concerning this child.	1697
Luke	And all they that heard [it] wondered at those things which were told them by the shepherds.	1698
Luke	But Mary kept all these things, and pondered [them] in her heart.	1699
Luke	And the shepherds returned, glorifying and praising God for all the things that they had heard and seen, as it was told unto them.	1700
Luke	And when eight days were accomplished for the circumcising of the child, his name was called JESUS, which was so named of the angel before he was conceived in the womb.	1701
Luke	And when the days of her purification according to the law of Moses were accomplished, they brought him to Jerusalem, to present [him] to the Lord;	1702
Luke	(As it is written in the law of the Lord, Every male that openeth the womb shall be called holy to the Lord;)	1703
Luke	And to offer a sacrifice according to that which is said in the law of the Lord, A pair of turtledoves, or two young pigeons.	1704
Luke	And, behold, there was a man in Jerusalem, whose name [was] Simeon; and the same man [was] just and devout, waiting for the consolation of Israel: and the Holy Ghost was upon him.	1705
Luke	And it was revealed unto him by the Holy Ghost, that he should not see death, before he had seen the Lord’s Christ.	1706
Luke	And he came by the Spirit into the temple: and when the parents brought in the child Jesus, to do for him after the custom of the law,	1707
Luke	Then took he him up in his arms, and blessed God, and said,	1708
Luke	Lord, now lettest thou thy servant depart in peace, according to thy word:	1709
Luke	For mine eyes have seen thy salvation,	1710
Luke	Which thou hast prepared before the face of all people;	1711
Luke	A light to lighten the Gentiles, and the glory of thy people Israel.	1712
Luke	And Joseph and his mother marvelled at those things which were spoken of him.	1713
Luke	And Simeon blessed them, and said unto Mary his mother, Behold, this [child] is set for the fall and rising again of many in Israel; and for a sign which shall be spoken against;	1714
Luke	(Yea, a sword shall pierce through thy own soul also,) that the thoughts of many hearts may be revealed.	1715
Luke	And there was one Anna, a prophetess, the daughter of Phanuel, of the tribe of Aser: she was of a great age, and had lived with an husband seven years from her virginity;	1716
Luke	And she [was] a widow of about fourscore and four years, which departed not from the temple, but served [God] with fastings and prayers night and day.	1717
Luke	And she coming in that instant gave thanks likewise unto the Lord, and spake of him to all them that looked for redemption in Jerusalem.	1718
Luke	And when they had performed all things according to the law of the Lord, they returned into Galilee, to their own city Nazareth.	1719
Luke	And the child grew, and waxed strong in spirit, filled with wisdom: and the grace of God was upon him.	1720
Luke	Now his parents went to Jerusalem every year at the feast of the passover.	1721
Luke	And when he was twelve years old, they went up to Jerusalem after the custom of the feast.	1722
Luke	And when they had fulfilled the days, as they returned, the child Jesus tarried behind in Jerusalem; and Joseph and his mother knew not [of it].	1723
Luke	But they, supposing him to have been in the company, went a day’s journey; and they sought him among [their] kinsfolk and acquaintance.	1724
Luke	And when they found him not, they turned back again to Jerusalem, seeking him.	1725
Luke	And it came to pass, that after three days they found him in the temple, sitting in the midst of the doctors, both hearing them, and asking them questions.	1726
Luke	And all that heard him were astonished at his understanding and answers.	1727
Luke	And when they saw him, they were amazed: and his mother said unto him, Son, why hast thou thus dealt with us?	1728
Luke	behold, thy father and I have sought thee sorrowing.	1729
Luke	And he said unto them, How is it that ye sought me?	1730
Luke	wist ye not that I must be about my Father’s business?	1731
Luke	And they understood not the saying which he spake unto them.	1732
Luke	And he went down with them, and came to Nazareth, and was subject unto them: but his mother kept all these sayings in her heart.	1733
Luke	And Jesus increased in wisdom and stature, and in favour with God and man.	1734
Luke	Now in the fifteenth year of the reign of Tiberius Caesar, Pontius Pilate being governor of Judaea, and Herod being tetrarch of Galilee, and his brother Philip tetrarch of Ituraea and of the region of Trachonitis, and Lysanias the tetrarch of Abilene,	1735
Luke	Annas and Caiaphas being the high priests, the word of God came unto John the son of Zacharias in the wilderness.	1736
Luke	And he came into all the country about Jordan, preaching the baptism of repentance for the remission of sins;	1737
Luke	As it is written in the book of the words of Esaias the prophet, saying, The voice of one crying in the wilderness, Prepare ye the way of the Lord, make his paths straight.	1738
Luke	Every valley shall be filled, and every mountain and hill shall be brought low; and the crooked shall be made straight, and the rough ways [shall be] made smooth;	1739
Luke	And all flesh shall see the salvation of God.	1740
Luke	Then said he to the multitude that came forth to be baptized of him, O generation of vipers, who hath warned you to flee from the wrath to come?	1741
Luke	Bring forth therefore fruits worthy of repentance, and begin not to say within yourselves, We have Abraham to [our] father: for I say unto you, That God is able of these stones to raise up children unto Abraham.	1742
Luke	And now also the axe is laid unto the root of the trees: every tree therefore which bringeth not forth good fruit is hewn down, and cast into the fire.	1743
Luke	And the people asked him, saying, What shall we do then?	1744
Luke	He answereth and saith unto them, He that hath two coats, let him impart to him that hath none; and he that hath meat, let him do likewise.	1745
Luke	Then came also publicans to be baptized, and said unto him, Master, what shall we do?	1746
Luke	And he said unto them, Exact no more than that which is appointed you.	1747
Luke	And the soldiers likewise demanded of him, saying, And what shall we do?	1748
Luke	And he said unto them, Do violence to no man, neither accuse [any] falsely; and be content with your wages.	1749
Luke	And as the people were in expectation, and all men mused in their hearts of John, whether he were the Christ, or not;	1750
Luke	John answered, saying unto [them] all, I indeed baptize you with water; but one mightier than I cometh, the latchet of whose shoes I am not worthy to unloose: he shall baptize you with the Holy Ghost and with fire:	1751
Luke	Whose fan [is] in his hand, and he will throughly purge his floor, and will gather the wheat into his garner; but the chaff he will burn with fire unquenchable.	1752
Luke	And many other things in his exhortation preached he unto the people.	1753
Luke	But Herod the tetrarch, being reproved by him for Herodias his brother Philip’s wife, and for all the evils which Herod had done,	1754
Luke	Added yet this above all, that he shut up John in prison.	1755
Luke	Now when all the people were baptized, it came to pass, that Jesus also being baptized, and praying, the heaven was opened,	1756
Luke	And the Holy Ghost descended in a bodily shape like a dove upon him, and a voice came from heaven, which said, Thou art my beloved Son; in thee I am well pleased.	1757
Luke	And Jesus himself began to be about thirty years of age, being (as was supposed) the son of Joseph, which was [the son] of Heli,	1758
Luke	Which was [the son] of Matthat, which was [the son] of Levi, which was [the son] of Melchi, which was [the son] of Janna, which was [the son] of Joseph,	1759
Luke	Which was [the son] of Mattathias, which was [the son] of Amos, which was [the son] of Naum, which was [the son] of Esli, which was [the son] of Nagge,	1760
Luke	Which was [the son] of Maath, which was [the son] of Mattathias, which was [the son] of Semei, which was [the son] of Joseph, which was [the son] of Juda,	1761
Luke	Which was [the son] of Joanna, which was [the son] of Rhesa, which was [the son] of Zorobabel, which was [the son] of Salathiel, which was [the son] of Neri,	1762
Luke	Which was [the son] of Melchi, which was [the son] of Addi, which was [the son] of Cosam, which was [the son] of Elmodam, which was [the son] of Er,	1763
Luke	Which was [the son] of Jose, which was [the son] of Eliezer, which was [the son] of Jorim, which was [the son] of Matthat, which was [the son] of Levi,	1764
Luke	Which was [the son] of Simeon, which was [the son] of Juda, which was [the son] of Joseph, which was [the son] of Jonan, which was [the son] of Eliakim,	1765
Luke	Which was [the son] of Melea, which was [the son] of Menan, which was [the son] of Mattatha, which was [the son] of Nathan, which was [the son] of David,	1766
Luke	Which was [the son] of Jesse, which was [the son] of Obed, which was [the son] of Booz, which was [the son] of Salmon, which was [the son] of Naasson,	1767
Luke	Which was [the son] of Aminadab, which was [the son] of Aram, which was [the son] of Esrom, which was [the son] of Phares, which was [the son] of Juda,	1768
Luke	Which was [the son] of Jacob, which was [the son] of Isaac, which was [the son] of Abraham, which was [the son] of Thara, which was [the son] of Nachor,	1769
Luke	Which was [the son] of Saruch, which was [the son] of Ragau, which was [the son] of Phalec, which was [the son] of Heber, which was [the son] of Sala,	1770
Luke	Which was [the son] of Cainan, which was [the son] of Arphaxad, which was [the son] of Sem, which was [the son] of Noe, which was [the son] of Lamech,	1771
Luke	Which was [the son] of Mathusala, which was [the son] of Enoch, which was [the son] of Jared, which was [the son] of Maleleel, which was [the son] of Cainan,	1772
Luke	Which was [the son] of Enos, which was [the son] of Seth, which was [the son] of Adam, which was [the son] of God.	1773
Luke	And Jesus being full of the Holy Ghost returned from Jordan, and was led by the Spirit into the wilderness,	1774
Luke	Being forty days tempted of the devil.	1775
Luke	And in those days he did eat nothing: and when they were ended, he afterward hungered.	1776
Luke	And the devil said unto him, If thou be the Son of God, command this stone that it be made bread.	1777
Luke	And Jesus answered him, saying, It is written, That man shall not live by bread alone, but by every word of God.	1778
Luke	And the devil, taking him up into an high mountain, shewed unto him all the kingdoms of the world in a moment of time.	1779
Luke	And the devil said unto him, All this power will I give thee, and the glory of them: for that is delivered unto me; and to whomsoever I will I give it.	1780
Luke	If thou therefore wilt worship me, all shall be thine.	1781
Luke	And Jesus answered and said unto him, Get thee behind me, Satan: for it is written, Thou shalt worship the Lord thy God, and him only shalt thou serve.	1782
Luke	And he brought him to Jerusalem, and set him on a pinnacle of the temple, and said unto him, If thou be the Son of God, cast thyself down from hence:	1783
Luke	For it is written, He shall give his angels charge over thee, to keep thee:	1784
Luke	And in [their] hands they shall bear thee up, lest at any time thou dash thy foot against a stone.	1785
Luke	And Jesus answering said unto him, It is said, Thou shalt not tempt the Lord thy God.	1786
Luke	And when the devil had ended all the temptation, he departed from him for a season.	1787
Luke	And Jesus returned in the power of the Spirit into Galilee: and there went out a fame of him through all the region round about.	1788
Luke	And he taught in their synagogues, being glorified of all.	1789
Luke	And he came to Nazareth, where he had been brought up: and, as his custom was, he went into the synagogue on the sabbath day, and stood up for to read.	1790
Luke	And there was delivered unto him the book of the prophet Esaias.	1791
Luke	And when he had opened the book, he found the place where it was written,	1792
